{
  "lead_id": "LH-0023",
  "business_name": "Rejuvenate Salon & Spa",
  "discovered_at": "2026-08-27T03:43:55.668219+00:00",
  "source": "research",
  "lifecycle_status": "QUALIFIED",
  "score": 85,
  "tier": "A",
  "website": "https://rejuvenatebd.com/",
  "verified": true,
  "verified_at": "2026-08-27T08:19:09.120525+00:00",
  "lead_type": "client",
  "niche": "Luxury salon and spa",
  "geography": "Dhaka, Bangladesh (Uttara, Unimart Centrepoint)",
  "pain_signals": [
    "Bangladesh premier luxury salon (3+ branches, 4.9 rating) — appointment-driven, high-ticket services",
    "Booking is phone-only — no online booking system, no automated appointment reminders",
    "High margin services (hair spa BDT2,600+, facial BDT3,500+, bridal prep) — every missed appointment is significant revenue",
    "No automated waitlist for peak times — walk-in clients turned away during busy periods"
  ],
  "offer_surface": "Autonomous AI agent deployment for Luxury salon and spa — targeting: Bangladesh premier luxury salon (3+ branches, 4.9 rating) — appointment-driven, high-ticket services; Booking is phone-only — no online booking system, no automated appointment reminders; High margin services (hair spa BDT2,600+, facial BDT3,500+, bridal prep) — every missed appointment is significant revenue",
  "contact_paths": [
    {
      "channel": "phone",
      "value": "+880 1886-123770",
      "confidence": 95,
      "source": "rejuvenatebd.com"
    },
    {
      "channel": "phone",
      "value": "+8801406699612",
      "confidence": 95,
      "source": "rejuvenatebd.com"
    },
    {
      "channel": "instagram",
      "handle": "rejuvenatebd",
      "confidence": 85,
      "source": "Instagram"
    }
  ],
  "evidence": [
    {
      "evidence_id": "E-0166",
      "kind": "website",
      "summary": "Website live (HTTP 200) at https://rejuvenatebd.com/",
      "confidence": 95
    }
  ],
  "notes": ""
}
